ASIN,Price,Title,Stars,Ratings,Manufacturer,Link,Description,Features
B08FG7L1ZP,569,Northzone Unisex 15.6 inch 25 L Casual Waterproof Laptop/Travel/Office/School/College/Business Bag/Backpack (Navy blue),4.1,186,,https://amazon.com/dp/B08FG7L1ZP,"NORTHZONE BACKPACK If you carry your laptop to and from work, then this laptop bag from Northzone will definitely make travelling easier. Compatibility This backpack can fit a 38.1 cm laptop comfortably. Compartments This bag has three spacious compartments to store the laptop, charger, external devices, and other accessories with ease. Pockets The two mesh pockets on either sides of this black and blue backpack allow you to store a water bottle, ID card and other knick-knacks, so you can access them easily.","“COMPATIBLE WITH 15.6 INCH LAPTOP”: The Northzone Backpack fits up to 15.6 inch laptop. Dimensions: 34cm x 15cm x 45.5cm; Weight: 499g.,“HIGH QUALITY, DURABLE AND WATER REPELLANT FABRIC”: This backpack features in durable snow yarn polyester fabric and streamlined design with a padded interior to protect notebooks and important items.,CONVENIENT TRAVEL"" Adjustable shoulder strap and padded laptop compartment together with a quilted back panel make it comfortable for all-day use.,CONVENIENTLY PLACED PADDED LAPTOP COMPARTMENTS AND POCKETS: The padded interior helps protect notebooks and important items. Quick access zippered front pocket for added storage. A quilted back panel make it comfortable for all-day use.,""HIGH QUALITY, CASUAL YET STYLISH DESIGN"": very attractive and perfect for school, travel and outdoor activities. The perfect backpack for those needing stylish all-day protection for their laptop."
B07YFNSYSJ,999,"FATMUG Men's and Women's Foldable Polyester Duffel Luggage Bag for Travel, Packing and Storage (60 L, Navy)",4.3,830,,https://amazon.com/dp/B07YFNSYSJ,,
B07Z9D3W9D,372,Mammon Women's stylish Handbags (Black),3.5,"2,785",,https://amazon.com/dp/B07Z9D3W9D,,
B07PFF4RYC,399,Storite Stylish Padded Small Nylon Sling Cross Body Travel Office Business Messenger Bag for Men Women (25x16x7.5cm) (Dark Grey),4.1,"6,867",,https://amazon.com/dp/B07PFF4RYC,"Brand: Storite Product Material: Nylon Polyester Product Dimension : · Length (Horizontal distance) - 16cm, Height - 25cm, Width - 7.5cm . Liter Size : 3 L. Small capacity but perfectly fits up to 10"" Tablet and you can use it as a business bag to put all your small Accessory Product Type: Cross body messenger travel Product description: Perfect messenger bag/shoulder bag/cross body bag/handbag/ hiking or travelling Bag, suitable for office, school, outdoor, business and other occasions. Freely adjustable shoulder strap, you can adjust it according to your height and comfort requirements. The stitching on this product is nice and very strong.","Nylon,Messenger Bag Dimensions – Length (Horizontal distance) - 16cm, Height - 25cm, Width - 7.5cm . small capacity but perfectly fits up to 10"" Tablet and you can use it as a business bag,Material: Sling Bag For Men Made of Nylon Polyester Material with zipper. Its padded storage is resistant to water, dirt and even a slash by sharp objects, so you don’t have to worry about anything.,Crossbody bag Structure: A total of 4 pockets (3 zipped pockets, 1 external side pockets without zipper) , adjustable shoulder strap. 6mm heatlon pads inside Sling bag which helps to prevent damage for phones etc.,IDEAL APPLICATION: Use this bag as a one side bag ,messenger bag, shoulder bag, suitable for your office, college, outdoor travels, university, meeting, and business for everyday use"
B07RSGR39V,"4,227","EUME Sapphire Stylish Laptop / Backpack with Built-In Massager for Men & Women | Anti-Theft | Fits Up-to 14"" Screen (Pink, 20L)",4.1,5,Avon Lifestyle Pvt Ltd,https://amazon.com/dp/B07RSGR39V,EUME world’s first massager backpack. EUME anti-theft massager laptop backpack is beautifully designed with unique feature which secure from unauthorized access by anyone around.,"Anti-Stress Backpack : This Massager Backpack Is “Anti-Stress” Designed To Keep Your Stress Free. The Back Is Designed In Such A Way That The Massage/Stimulation Helps Your Relax Leading To Your Physical And Mental Wellness. The Stimulation On The Sides Of The Trapezium And Back Improves The Blood Flow Thus Relaxing Your Core Muscles And Neuro Muscular System.,Inbuilt Massager Facility : Upper Massager Panels Relaxes Your Shoulder & Trapezium. Air Channels Provides Support To Your Spine, Maintains Its Shape And Allows Airflow To Reduce Sweat Accumulation. Lower Level Massager Panels Relaxes Your Lower Back.,Have Massage And Carry Bag : Spacious, Tough, Dust Resistant ,Durable, Water Resistant, Light In Weight Bag And To Get Massage You Just Need To Attach The Power Bank And Just Relax.,Charging Instructions : Inside The Bag There Are Two Inbuilt Usb Ports With The Help Of Which We Can Charge Or Use The Massager By Connecting To The External Powerbank Of 10000 Mah Or Higher.,How To Use : Just ""Press To De-Stress"" To Get The Massage At The Upper Back Just Press The Button Once.The Lower Back Massagers Will Get Activated By Pressing The Button Twice.To Get Both Upper & Lower Massagers Activated Press The Button Thrice.Turn Them Off By Pressing The Button Fourth Time. Washing Instructions : We Would Recommend You To Clean The Backpack With Wet Drenched Mop And Dry It In Natural Sunlight As This Backpack Involves Electrical Components."
B082PKX18C,939,Artistix Talon Anti-Theft Design Laptop Backpack Bag in Water Resistance With USB Charging Port (46 Cm) (Black),4.3,"1,614",,https://amazon.com/dp/B082PKX18C,Business Casual Charging Pack. USB CHARGING GUARD AGAINST THEFT WATER REPELLENT FABRIC For Business travel. Structure : Laptop / Ipad Pocket / Phone / Document / Camera / Zipper Pocket.... Capacity : 13.3 Inches Laptop / I pad / Clothes / Umbrella / Cosmetic,"Zipper closure,USB CHARGING PORT. Extended out charging port allows you to charge your phone while you are on the move. With an attached charging dock, you may connect a portable power bank with ease.,ANTI THEFT BACKPACK. There is anti-theft zippered pocket is provided in lower back for keeping valuables like passport, wallet, credit cards etc. safe.,MULTIPURPOSE MINI LAPTOP BACKPACK FOR DAILY OFFICE USE, COLLEGE or TRAVEL ETC. 180 degree opening. Have enough space for carrying books or one day cloth. Front stash pocket for small book, documents, goggle, medicines etc.,WATER RESISTANCE FABRIC. PADDED LAPTOP SLEEVES & SEPARATE PADDED TABLET SLEEVE. Suitable for 13.3” laptop, tablet, power bank, mobiles etc.,Genuine Artistix Products with 18 Months Warranty against Manufacturing Defects"
B08S3STK3R,799,SEMITO Waterproof Laptop Handbag Notebook Bags Men Women Handbags Canvas Computer Bags Laptop Bags 13 14 15 inch Travel Shoulder Bags,4.0,9,,https://amazon.com/dp/B08S3STK3R,"SEMITO Waterproof Laptop Handbag Intimate Design, Shockproof Inside, Think Plush Design Soft Scratch Resistant, Fine Workmanship, Excellent Quality, All-Round Protection Of Your Machine.  High-Quality Splash Proof, Only To Better Protect Your Computer.  Slim And Lightweight.  Top Handles Of The Case Enable You To Carry Your Laptop In Comfort.  Made of exquisite suits fabric material with velvet lining, provide 360° protection for your laptop.Does Not Bulk Your Laptop Up And Can Easily Slide Into Your Briefcase, Backpack, Or Other Bag.   Excellent Quality, Practical And Stylish Design.  The metal zipper slides smoothly, allows easy access to your laptop computer, practical and stylish.  Compatible Devices:  Apple: 13 inches MacBook Air, 13 inch MacBook Pro Retina  Microsoft: Surface Book, Surface Laptop, New Surface Pro 2017/ Pro 4/ Pro 3  HP: Spectre x360, Envy 13, EliteBook x360, Pavilion x360, Chromebook 13  Dell: XPS 13, Latitude 13, Inspiron 13, Chromebook 13  Asus: ZenBook UX305, ZenBook U3000, RX310 Lenovo: Yoga910(Yoga 5 Pro), Yoga920(Yoga 6 Pro), Yoga 720, Ideapad 710S, Ideapad 720S, ThinkPad S1, ThinkPad S2  Acer: Aspire S7, Swift 7, Chromebook R13  Toshiba: Chromebook CB35 Available for most 11-13.3 Inch Ultrabook/ Notebook/ Laptops Computer. And All 15"" Laptop  Package included 1x Laptop Bag","Multi-functional compartments offer independent spaces for your laptop, iPhone, iPad, phone, camera, passport, pens, keys, wallet, watch, usb cables, mouse, 4A file, books, clothes, umbrella, bottle, sunglasses and more,Easy to find what you want,Large capacity makes it can be used at travel, school, work, holiday, outdoor activities, etc,Internal design: perfect for all your business needs ,The briefcase with compartments offer independent spaces for your laptop, iPhone, iPad, passport, pens, keys, wallet, watch, charger, MP3, A4 file, books, clothes, umbrella, bottle and more. Easy to find what you want;,Dimensions: It fits 11.6inch , 12inch , 13.3inch , 14inch , 15inch , 15.6inch laptop /notebook/computer or smaller size devices.,Occasion: Perfect for work, travel, trips, and other day to day activities,which enrich your work,speed up your life;,Exterior design: It features 2 compartment, zippered closure."
B097JMR4M6,"1,799","Safari Seek 32 Ltrs Overnighter Travel Laptop Backpack (Black), Water Resistant Spacious Bag pack for Travelling and Camping, All-Purpose Bag for Business & Leisure",,,Safari,https://amazon.com/dp/B097JMR4M6,"Seek 32L is a compact offering from Safari's overnighter laptop backpack ranges. Equipped with a unique offering of luggage-like opening (or book opening), this bag is perfect to meet ALL your travel needs - Work or Adventure Leisure! Made out of water-resistant fabric & front panel design, it serves as a highly elegant look. On the inside, cross packing straps are provided to help organise your packing. With a 17"" laptop and a tablet compatibility compartment Seek 32 has a total capacity of 32 liters, provided with compression straps and breathable back mesh that prevents the back of the backpack from overheating. Go ahead and add this friendly Seek overnighter backpack to your travel collection, whether it be for a short business trip or a weekend getaway!","MULTIPLE UTILITIES: This 2-in-1 premium quality water resistant backpack with dual handles (side and top) perfectly combines work with leisure with its ergonomical design that not only fulfills heavy packing for travel but also fulfills the daily needs for men, women and teens. The 32L bag is well suited for office tour, college, trekking and camping purposes.,SPACIOUS AND LIGHTWEIGHT: Super spacious laptop overnighter comes with a large suitcase compartment which can efficiently accommodate your clothes and other essential utilities required for 1-2 days stay. The bag comes with a separate compartment compatible with a laptop and a tablet.,HIGH QUALITY PREMIUM FABRIC: Made of 100% polyester and water resistant fabric, the material used is lightweight yet highly durable. This heavy duty fabric is perfect for all types of travel needs.,COMPRESSION STRAPS & SHOULDER SUPPORT: With heavy-duty, durable compression straps & buckles user can immediately restrict the movement of items inside the bag providing comfort while carrying the bag. Padded shoulder straps provide comfort during prolonged use.,BREATHABLE BACK SUPPORT: Seek is equipped with premium quality air mesh in its back panel - A premium quality back air mesh made for maximum aeration, that prevents overheating & provides ulltimate comfort."
B07QX58HGR,262,Blue Tree Velvet Kids School/Nursery/Picnic/Carry/Travelling Bag - 2 to 5 Age (_Best_Red_Strawberry),4.0,154,,https://amazon.com/dp/B07QX58HGR,Here comes Strawberry Bag for your cute ones which will surely be liked by them and they will love to go to their school with their favourite Shoulder Bag. Its made of soft plushy fabric. Key Features Age - 1 Years+ Fabric - Soft skin friendly fabric Colors and materials gives a wonderful look Light in weight,"Non-Toxic And Soft Fabric good quality and Washable,Soft And Cuddly Filling, Made By India And Printed Bag,Very Attractive To Make You Have A Good Feeling All The Time,,Gift this soft, smooth and cuddly Strawberry bag as a great gift to your loved one,Soft Toy School Bag For Kids, Travelling Bag, Carry Bag, Picnic Bag, Teddy Bag"
B079DFHYHP,"1,690",Wildcraft 44 Ltrs Casual Backpack (11629-Wolf_Blue),4.5,271,,https://amazon.com/dp/B079DFHYHP,,
B097JHTGGP,459,"Genie Chekmex Backpack for Women - 2 compartments, School Bags for Girls, Stylish and Trendy College Backpacks for Girls, Water Resistant and Lightweight Bags for Office and Travelling Purpose.",4.5,18,,https://amazon.com/dp/B097JHTGGP,,
B077BGKMJ9,"1,499",HP 2SC65AA 14-inch Slim Laptop Briefcase (Black),4.3,45,,https://amazon.com/dp/B077BGKMJ9,"Whether you're heading to the office or working from the road, the HP 14. 1 Business Slim Top Load adds a modern touch for the minimalist professional who carries a notebook. It has lockable zippers, a secure RFID pocket, and room for your device up to 14. 1"" diagonal and daily essentials. FeaturesSecure inside and outPut a buffer between your personal information and electronic pickpockets with an RFID pocket that helps protect the data encoded on credit cards and passports. Deter tampering and access to your notebook with double-coil, lockable zippers. Clutter-free carryallPack it all in and stay organized with a dedicated notebook compartment and plenty of slip and zip pockets for all your accessoriesfort is keyWear the bag across your chest and keep your hands free, or carry by hand with the double handles. Commuting and traveling are easier than ever with a luggage pass-through that fits over the handle of most rolling suitcases. Manufacturer: HP Manufacturer Part Number: 2SC65AA. Brand Name: HP. Product Name: 14. 1 Business Slim Top Load. Product Type: Carrying Case. [Additional Product Specifications] Full Product Specifications: Click to view. [Product Information] Accessibility: Top Loading. Carrying Options: Handle. Shoulder Strap. Maximum Screen Size Supported: 14. 1"". [Physical Characteristics] Height: 2"". Width: 15"". Depth: 10. 8"". [Miscellaneous] Application/Usage: Notebook. Credit Card. Passport. Accessories. Compatibility: HP - Notebook.","Full Product Specifications: Click to view,Accessibility: Top Loading,Carrying Options: Handle,Carrying Options: Shoulder Strap,Maximum Screen Size Supported: 14. 1"""
B097JJS47M,459,"Genie Daffodil Backpack for Women - 2 compartments, School Bags for Girls, Stylish and Trendy College Backpacks for Girls, Water Resistant and Lightweight Bags for Office and Travelling Purpose.",4.7,5,,https://amazon.com/dp/B097JJS47M,,
B08ZNC3JM9,399,DIXON Synthetic Leather Casual Travel Chain Shoulder Deatachable Slingbag For Women,4.1,"1,292",,https://amazon.com/dp/B08ZNC3JM9,"DIXON is a Brand which is specialized in providing varied bags, wallet, clutches, simple but utility, classical but fashionable bags, bags, wallet, clutches. Providing material, elaborate craftsmanship and multi purpose design is the most pursuit of DIXON. Every bags, wallet, clutches you will receive has been through hundreds of procedures to ensure its excellent.If you are a bags, wallet, clutches, dixon bags, wallet, clutches will definitely be your first choice.","Pu Leather,Synthetic Leather,[*MATERIAL]: We use the soft high quality PU leather with heavy golden chain sling bag for women for this bag, soft, comfortable, safe, fashionable, it is design to all ladies sling bag sling bags for women bags for women stylish and slim bag for women,This handbag is in a classy cream that's sure to turn heads wherever you go. The versatile design can be carried to both formal and casual occasions. Its sturdy build and elegant design make it a true workhorse for the working woman.,1 Roomy space with 1 main compartment sections and one zipper pocket which Comfortably holds your Phone, wallet, cosmetic, power bank, water bottle.,Fashion City shoulder bag for daily and travel use. Perfect for dating, shopping, working, traveling, vacation, party and other occasions. Because of its good color it can go with pretty much any outfit you can think of, or pair with.,Care Instructions: Do Not Expose To Extreme Heat. Clean With A Soft Moist Cloth. Keep The Bag Stuffed When Not In Use To Avoid Wrinkle"
B07BZ5VC4H,"1,989",Safari Seek 45 Ltrs Overnighter Expandable Travel Laptop Backpack,4.5,"3,806",,https://amazon.com/dp/B07BZ5VC4H,,
B09B27LP25,"1,165","Safari Tribe 35 Ltrs Large Laptop Backpack with 3 Compartments, Water Resistant Fabric - Blue (TRIBE19CBBLU)",3.8,656,,https://amazon.com/dp/B09B27LP25,,
B082PMDYR7,"9,145",Scarters | Ultimate Premium Laptop Backpack for Business in Water Resistant Anti-Abrasive Nylon Fabric: Terminal ~ Navy Blue for up to 15.6 inch Laptop/MacBook,4.7,96,,https://amazon.com/dp/B082PMDYR7,,"DURABLE LAPTOP BACKPACK: Terminal is your ultimate carrying companion in the fast paced work life. Built to be resilient, designed to smartly occupy just a little more than what you need & styled to look absolutely professional, this laptop backpack will go places with you,DIMENSIONS: H 17.9 in W 12.8 in D 7.1 in | Weight: 2.9 lbs | Material: Water-Resistant 1680 Denier Anti-Abrasive Nylon Fabric, Microfiber Vegan Leather | Laptop Sizes: 12 inch / 13.3 inch / 14 inch / 15 inch / 15.6 inch,SPACIOUS INTERIORS: An easy to open Electronics Compartment for a quick airport security check with a Laptop Sleeve, Kindle / Tablet Sleeve, Two Mesh Pockets & a Master Compartment with Power Bank Holder,THOUGHTFUL EXTERNAL POCKETS: Two quick-access pockets & detachable & convertible waist sling in the front. Two side pockets for phone / bottle. And one secret back pocket,TRAVEL EASIER: USB charging port & cord, easy slip-on Suitcase Strap, Faux Luggage Tag, Padded Shoulder Straps, Great for Business Travelers"
B09SWWYR66,851,COSMUS Eternal Laptop Backpack 20 Ltrs Polyester Bags for 15.6-inch Laptops,3.6,3,,https://amazon.com/dp/B09SWWYR66,COSMUS Eternal Laptop Backpack 20 Ltrs Polyester Bags for 15.6-inch Laptops,COSMUS Eternal Laptop Backpack 20 Ltrs Polyester Bags for 15.6-inch Laptops
B0B6SN7DQ9,999,HP Evon Essential Series Black Laptop Backpack for Upto 15.6 Inch (39.6 cm) Laptop/Chromebook/Mac (Black) (2P7U6P3),,,,https://amazon.com/dp/B0B6SN7DQ9,,
B07MGDFT9C,"1,399",HEROZ Hammer Unisex Nylon 45 L Travel Laptop Backpack Water Resistant Slim Durable Fits Up to 17.3 Inch Laptop Notebook (All) (Grey & Black),4.3,"6,659",A. H. Creation,https://amazon.com/dp/B07MGDFT9C,"The HEROZ basic backpack ensures complete safety to your 17.3 inch laptop with high quality build and wide range of built-in features, With Dual Side Pocket In the in side of the bag, featuring a protective padding, you can rest assured that the laptop inside it will be well cushioned from any accidental caused when you bump into any surface. As it is made of nylon, can withstand abrasions and is long lasting. A Front Pocket With An Organizer. It also features Reflector Logo and Reflector patch which is highly useful for motorists, cyclists, walking at night, The inner material is made of polyester. This backpack is also water-resistant.","Material: Nylon, Inner Material: Polyester, Capacity: 45 Liters, Color: Grey & Black, Special Features: Back Padding, Chest Strap, Earphone Cord Support, Hip Belt, Integrated Rain Cover, Laptop Compartment, Telescope Handle, Water Bottle / Umbrella Pouch, Zip Closure, Padded Handles, Shoulder Strap, Shoe Compartment,Water Resistant,Warranty type: Manufacturer, 1 year domestic warranty,Closure: Zipper,For Our Business & Fashionable Style Day Backpack"
B08YF9VHTY,649,Genie Flamenco2 Casual Backpacks for Women,4.5,754,,https://amazon.com/dp/B08YF9VHTY,,
B07M9BRCQ5,899,Fur Jaden Brown Textured Leatherette Stylish & Spacious Weekender Duffle Bag for Travel,4.3,"3,481",,https://amazon.com/dp/B07M9BRCQ5,,
B08FMSRJCL,569,"Northzone Men's and Women's Stylish Lightweight Casual Travel Laptop Bag for School, College, Office (Navy Blue)",4.3,47,,https://amazon.com/dp/B08FMSRJCL,"NORTHZONE BACKPACK If you carry your laptop to and from work, then this laptop bag from Northzone will definitely make travelling easier. Compatibility This backpack can fit a 38.1 cm laptop comfortably. Compartments This bag has three spacious compartments to store the laptop, charger, external devices, and other accessories with ease. Pockets The two mesh pockets on either sides of this black and blue backpack allow you to store a water bottle, ID card and other knick-knacks, so you can access them easily.","CONVENIENT TRAVEL"" Adjustable shoulder strap and padded laptop compartment together with a quilted back panel make it comfortable for all-day use.,“CONVENIENTLY PLACED PADDED LAPTOP COMPARTMENTS AND POCKETS: The padded interior helps protect notebooks and important items. Quick access zippered front pocket for added storage. A quilted back panel make it comfortable for all-day use.,HIGH QUALITY, CASUAL YET STYLISH DESIGN"": very attractive and perfect for school, travel and outdoor activities. The perfect backpack for those needing stylish all-day protection for their laptop.,Includes a laptop compartment that can easily accommodate a laptop upto 15.4 inches.,“COMPATIBLE WITH 15.6 INCH LAPTOP”: The Northzone Backpack fits up to 15.6 inch laptop. Dimensions: 34cm x 15cm x 45.5cm; Weight: 499g."
B07T9GB7RN,"1,067",Lavie Women's Ushawu Satchel Bag | Ladies Purse Handbag,4.1,"3,377",,https://amazon.com/dp/B07T9GB7RN,,
B08X2T2M8G,499,"Bennett Mystic 15.6 inch(39.6cm) Laptop Shoulder Messenger Sling Office Bag, Water Repellent Fabric for Men and Women (Blue)",4.1,"2,522",Texcoco Enterprises,https://amazon.com/dp/B08X2T2M8G,"Bennett sleeves cases and bags feature modern designs that can be as bold or as understated as you want to make them. The cases are constructed from durable, high quality materials dedicated to provide the utmost protection for your device and make it easy to keep all of your related gear with you at all times. Simple and Generous design for men and women who like to travel in style and commuting to work but added protection. Bennett Laptop Shoulder Messenger Bag Fits most 14-15.6 Inch Computer / Notebook Slim appearance design, fashion, simplicity, leisure and generous laptop bags can be both casual and professional, it easily go over the shoulder strap and is incredibly versatile. Ladies or men can use it to carry the computer to a college class, a business meeting or a country -country plane trip / travel.","High quality Material: The outside of this laptop bag is made of high quality water Repellent Fabric, high well-pad soft fleece inside,comfortable touch, provide 360°protection for your laptop and various device.,Multifunctional lightweight Laptop Sleeve: 2-way to carry: provide a removable shoulder strap,can be use as shoulder bag or handbag base on your need;Hideable handle strap,when hide it, easier to slide to your backpack as a inner bag.It will be a good partner for your daily use or business trip.,Excellent Detail: Use Exquisite zipper,all stress points have been strengthened, make sure the bag does not fall apart when carrying heavy goods.,External Dimensions: 16 x 12 x 3 inch；Internal Dimensions: 16.5 x 11.5 x 2.5 inch.Suitable for 17-17.3 inch: Dell, Acer, ASUS, Samsung, HP and other brand laptops.(Please allow a little size different because of manual measurement).,BENNETT Warranty : Exchange within （3 months） if you don't like. If any problems, please do not hesitate to contact us. We will provide the best solution for you."
