ASIN,Price,Title,Stars,Ratings,Manufacturer,Link,Description,Features
B08PSX1LN9,"1,299",Half Moon 45L Hammer Waterproof Laptop Travelling Rucksack Trekking Backpack for Travel Journey bags for Men Women Boys & Girls with 17.3inch Laptop Compartment & Rain cover,4.3,325,AB Amazing Bags,https://amazon.com/dp/B08PSX1LN9,"This Rucksack backpack ensures complete safety to your 17.3 inch laptop with high quality build and a wide range of built-in features, With a Dual Side Pocket In the inside of the bag, featuring protective padding, you can rest assured that the laptop inside it will be well cushioned from any accidents caused when you bump into any surface. As it is made of nylon, can withstand abrasions and is long lasting. Chest Strap, Hip Belt, Straight Shaped Straps structure which fits on your shoulders very comfortably makes you lift heavy objects easily. A Front Pocket with an Organizer helps you store your small essentials. It also features Reflector Logo, Rain cover and Reflector patch which is highly useful for motorists, cyclists, walking at night. It also features an Earphone Cord Support which very useful for long travelers. The inner material is made of polyester. This backpack is also water-resistant.","ROOMY ENOUGH : This Rucksack bag is lightweight and comes with Three main compartment having the capacity of approx 50 Ltr, big enough to carry laptop of all sizes, books, clothes, camping gear; 3 main compartments to store all your essentials, A back mesh pocket to carry extra documents and numerous small pocket to carry all your small accessories.,COMFORTABLE TRAVEL : Backside Honeycomb padded structure which helps you travelling comfortably all day long, provides proper air circulation while in summer also to prevent you feel more relax. Chest Strap, Hip Belt, Straight Shaped Straps structure which fits on your shoulders very comfortably makes you lift heavy objects easily.,CAPACITY : 50 Litres; Weight: 0.7 kg ; Dimensions: 56cmX36cmX25cm ; Utility : Ideal for Travel, Hiking, Trekking & Camping, Day trip.,HIGH QUALITY : A major problem in many rucksack and travelling bags is that it get torn between your journeys or within a short period of time but this Rucksack which is made from high Quality materials, is stitched properly and has bartacks on pressure points is strong enough to hold all your items without any problem,SPECIAL FEATURES : Back Padding, Chest Strap, Earphone Cord Support, Unique Design, Hip Belt, Integrated Rain Cover, Laptop Compartment, Telescope Handle, Water Bottle / Umbrella Pouch, Zip Closure, Padded Handles, Padded Shoulder Strap , Breathable Mesh etc."
B07TFRJTVG,675,Moritz Envelope Flap Over Sling Bag,4.4,5,,https://amazon.com/dp/B07TFRJTVG,,"Stylish sling bag featuring a smooth hand feel,Front flap with herringbone texture,Metal chain sling belt for a classy look"
B08Z619V6Z,999,"Veneer Laptop Bag 15.6 Inch, Business Briefcase for Men Women, 15inch Water Resistant Messenger Shoulder Bag with Strap, Durable Office Bag, for Computer/Notebook/MacBook,Black (Grey)",4.3,"2,038",,https://amazon.com/dp/B08Z619V6Z,"✅💽 - SPACIOUS STORAGE & COMFORTABLE FOR TRAVEL - Fit all your stuff easily! Pockets include the main pocket for books, food, umbrellas, etc. - You have a thick padded pouch for protecting your laptop, special pockets for phones, ID cards, and a unique cool hooking system for all your wires! The sleek design allows easy and comfortable travel while not compromising on space. don't buy those bulky bags that are heavy and have limited space, they will just drag you with them all day. Buy Veneer","Multi-Compartment Organizer: The men laptop briefcase includes external 2 pouches & 2 pen slots and inside several slots in front large pocket with Velcro closure under flap over, storage pen holders, documents, binder, power cords, mouse; 1 main zipper Pocket with foam padded sleeve fits most 15 15. 6 inch Laptop notebooks MacBook Ultrabook Chromebook; back invisible zipper pocket for your valuables,Durable Material: This computer laptop bag is made of high quality water resistant durable synthetic Leather with smooth metal zipper and durable metal hook of strap;Stylish and functional,this is a nice gift idea for Mothers day ,Fathers day from daughter son,Easy Carrying: Men's laptop messenger bag comes with a flat pass-through strap along the back, which allows the men briefcase bag to securely slip over the handle of any rolling luggage for hands-free transport,?Daily Usage?The briefcase is water resistant and antitheft.Office bag with metal hooks and metal double zippers keep long lasting for men/women.Great for business/school/gym/travel.,Comfort & Convenience: Dual sturdy wrapped bale handles for comfortable use, detachable adjustable PU padding shoulder strap inside the bag can easily convert your computer briefcase bag to a single-shoulder bag which bring you convenience in different occasion"
B099NM8621,827,"ZIPLINE Synthetic Leather Executive SMALL messenger bag for upto 13"" Laptop/Tablet for men women with multiple compartments (1-Tan Bag)",4.0,213,"Atulitu Agency, ,251/3364, Tagore Nagar - 1, Vikhroli East, Mumbai - 400083 (9820078070)",https://amazon.com/dp/B099NM8621,,"Premium Material Waterproof Construction - Made of superior Leatherette with heavyish water-resistant coating to ensure the use of long-term.The Leatherette Material comes with a very executive appearance.Handmade series transforms the original natural beauty into every Laptop bag,Plenty of Space & Padded Laptop Sleeve - The laptop bag is a decent large size that fits 14''MacBook Pro.Main compartment with zipper closure outside;The inside consist of a divider,a 14''laptop can easily fit inside and a built in divider between the inside compartment to help separate them all.1 zipper pocket inside for significant articles such as wallets and identification documents, inner slip pockets,1 back slot is perfect for an iPad mini.,Wide Strap - This satchel could also be a professional briefcase after detaching this strap.Adjustable and detachable strap makes it easy to handle and carry.,Incredibly Stylish - Sturdy enough to stand on its own,looks high end with formal or casual attire. Perfect for executives, business, casuals or travelers want to make a fashion statement. This sleek and spacious laptop messenger bag can also be used as a: Leather messenger bag for men, laptop leather bag, messenger bag for women, college bag, meeting bag, gift idea, birthday present, present, vintage leather bag, quality bag, unisex bag, leather bag,black leather bag.,External Dimensions: 14""(L)x12""(H) x 4""(W) ,Laptop pocket: 13.5'' (L)x8""(H)'',Shoulder Strap adjusts:- 65'',,Strap Width: 1.5''."
B09W31HG4D,"1,979","Zouk Unisex Black Ikat Striped Laptop Backpacks for Office , College and Travel| Fits upto 15.6 Inch Laptop",1.0,1,,https://amazon.com/dp/B09W31HG4D,,
B09CMTPNHH,"7,697",Satya Paul Navy Leather Laptop Bag,,,,https://amazon.com/dp/B09CMTPNHH,,
B09X2WD74X,599,"Hyder laptop compartment backpack for school, college, work, 35 L Laptop Backpack 35 L Laptop Backpack",4.0,1,,https://amazon.com/dp/B09X2WD74X,,
B07B516P18,"1,035",Casual College Bags - Killer Munich 29L Trendy Polyester Laptop Backpack,4.2,659,,https://amazon.com/dp/B07B516P18,"This trendy Colourful & durable bag will definitely grab attention of all the people.Â The beautiful Orange colour Bag combined with elegant Grey makes it very attractive. The trendy youth design which makes it elegant and stylish. The bag comes with a spacious large compartment that are enough to keep your belongings along with one fron full size pocket and one easy access vertical zipper pocket, two side mesh pocket for bottle.Â Carrying this bag at College or Office will surely make you center of attraction.Features:Fabric: PU Coated water resistance Durable FabricÂ Dimension:18.75 x 13.00 x 7.25 [HxWxD] (inches)Weight: 525gmÂ Utility: College Bags, Casual DaypackÂ","PU Coated water resistance Durable Fabric,College Bags: Spunk Up Your Style Quotient with youth and trendy design,Dimension:18.75 x 13.00 x 7.25 [HxWxD](inches); Weight:525gm,Multi-purpose Bag Light-weight colourful College bag,1 year on Manufacturing Defects"
B09QMMR63Q,499,Right Choice Laptop backpack multicolor unisex bag,3.2,75,Right Choice,https://amazon.com/dp/B09QMMR63Q,"Product features 3 main zippered compartments, Laptop backpack sleeve Strong Sleeve Denim; Age Range Description: Adult; Closure Type: Zipper","The backpack has 3 main compartment a front zipper pocket for the ID card, Sanitizer,masks, House keys, second compartment with pockets for the earphones, pens, notebook, Fitness Band. Spacious second compartment for all your essentials such as a lunch box .third compartment charger,tablet,books,power bank,wellet,and sunglass compartment for laptop.,Utility Suitable for casual usage, school / college / office n travel. backpack,bag for men & women boys and girls,Outer Material Type: Denim; Age Range Description: Adult; Closure Type: Zipper"
B07QHMKHWH,849,"Genie Camellia 27 litres Pink School Backpack (17 inch, Water Resistant)",4.3,"1,517",,https://amazon.com/dp/B07QHMKHWH,,
B09SD9ZWFG,569,Business Waterproof School Bags Bagpack Travel Laptop Shoulder Backpack Anti Theft Backpack for College Travel Outdoor,5.0,2,,https://amazon.com/dp/B09SD9ZWFG,"Anti Theft Design - This backpack by Northzone has anti theft design where zipper of the main pocket is hidden at the back. No thief, intruder or robber can find a way to open the backpack, making this totally theft proof. There are secret pockets on the shoulder strap and on the sides of the bag allowing us to keep travel documents, boarding pass, credit cards, mobile phone, earphones etc.","KEY FEATURES - Black & Grey Colour Laptop Backpack for Men and Women for Stylish Office use as well as for Trendy College students. Huge compartment size that can fit upto a 15.6 inch Laptop with ease. Multiple pockets for other accessories,Charging On the Go - Now charge your phone on the go while travelling without the hassle of holding the bulky power bank in your pocket or in your hand. Simple Connect your Powerbank to the wire inside the Bag and leave it in the bag. When you want to charge your phone, just connect your phone charger to the bag and your phone will start charging. IMPORTANT NOTE: We do NOT provide Free Portable Charger with the Bag,Essence of Northzone- We craft signature Laptop Backpacks and Casual Backpacks that are young, vibrant and fashionable, and yet a celebration of timeless style, luxe and sophistication. We strive to make thoughtful designs that are high on aesthetics as well as on utility and functionality.,WARRANTY- 6 Month Manufacturer Warranty. 100% Genuine Northzone Men products, 10 days No Question asked replacement guarantee from the date of delivery."
B09QMNYRVL,499,Right Choice Laptop backpack multicolor unisex bag,3.2,75,Right Choice,https://amazon.com/dp/B09QMNYRVL,"Product features 3 main zippered compartments, Laptop backpack sleeve Strong Sleeve Denim; Age Range Description: Adult; Closure Type: Zipper","The backpack has 3 main compartment a front zipper pocket for the ID card, Sanitizer,masks, House keys, second compartment with pockets for the earphones, pens, notebook, Fitness Band. Spacious second compartment for all your essentials such as a lunch box .third compartment charger,tablet,books,power bank,wellet,and sunglass compartment for laptop.,Utility Suitable for casual usage, school / college / office n travel. backpack,bag for men & women boys and girls,Outer Material Type: Denim; Age Range Description: Adult; Closure Type: Zipper"
B09NFSC3RP,349,"SHW SOLAR BLACK LAPTOP BAG WITH PADDED LAPTOP COMPARTMENT SUITABLE FOR 15.6"" LAPTOP II ADJUSTABLE STRAPSII WATER BOTTLE POCKETII TWO COMPARTMENTS",3.8,63,,https://amazon.com/dp/B09NFSC3RP,"SHW Solar Black Laptop Bag - Spacious, stylish bag with padded laptop compartment suitable for 15.6"" laptop, water bottle holder, two main compartment and one front pocket offering good space.","Padded laptop compartment suitable for 15.6"" laptop,Water bottle holder pocket II 2 main compartment and one front pocket,Dimension : 44 x 30 x 16 cm II Capacity : 21 Litres,Padded and adjustable shoulder straps,Durable,long lasting, flexible and lightweight"
B07V5N6XGB,551,Fiesto Fashion Women's Handbag With Sling Bag (Set of 2) (FF0719004_Black),3.8,44,,https://amazon.com/dp/B07V5N6XGB,"Look uber stylish and trendy by wearing this handbag and wallet for women from Women's purse. Made from polyurethane (pu), this handbag is capacious and perfect for keeping your everyday essentials. Pair this bag with casuals of your liking to look smart.The sling bag/ Wallet is an added accessory along with the handbag and together they make up a cool accessory combo.","Leatherette material handbag, The sling bag/ Wallet is an added accessory along with the handbag,Zip closure with double handle,Spacious compartments and pockets,6 month domestic warranty against manufacturing defects,"
B0895ZZHKK,699,Asus BP1504 39.62 cm (15.6-inch) Laptop Backpack (Dark Grey),4.2,"1,042",Asus,https://amazon.com/dp/B0895ZZHKK,"ASUS BP1504 offers stylish, elegant protection for laptops with displays up to 15.6 inch. Elegant and lightweight Cross-dyed Woven Fabric making for a truly beautiful accessory to any NoteBook laptop.","Meant for 15.6-inch laptops,Multiple compartments for additional accessories,Front big pocket for quick-access your essentials,Elegant and Lightweight Cross-dyed woven fabric,Finished in Stylish warm dark grey and stretch to shoulder strap,Laptop compartment fits up to 15.6 inch laptop with velcro laptop strip,ASUS reflective logo,1 Year hardware warranty provided by the manufacturer from date of purchase"
B09VTCNN75,749,"Fur Jaden Anti Theft Number Lock Backpack Bag with 15.6 Inch Laptop Compartment, USB Charging Port & Organizer Pocket for Men Women Boys Girls",4.1,652,FUR JADEN,https://amazon.com/dp/B09VTCNN75,"Stay organized all day with a durable and lightweight backpack from Fur Jaden. This back pack is a stylish and functional accessory for men and women. Can add admiration to an appealing and daring personality with a remarkable aesthetics and functionality. This backpack features an anti-theft design. You can also charge your phone on the go and organize your stuff like pro. Fur Jaden functional back pack is apt to protect your gadgets and belongings from being stolen while you travel, thanks to its special anti-theft design. Now keep your belongings safe with style. The backpack features multiple compartments that you may use for your laptop and other essentials. A remarkable feature of this backpack allows you to charge your phone while you are on the move. With an attached charging dock in the back you may connect a portable power bank with ease. Weighing about 600grams, this backpack is lightweight. The backpack is able to house a laptop of up to 15.6 inches and has seven inner compartments to place your other essentials. Made from durable quality polymer this Fur Jaden back pack is sturdy and reliable. Flaunt this bag with style and low maintenance as this bag is washable. This backpack is also suitable for school or college. The straps are designed to distribute the weight equally on each shoulder preventing any sort of discomfort. Use this back pack for office, college/school or during travels.","Number Lock: This Fur Jaden Anti Theft laptop backpack comes equipped with a Number Lock. This helps keep your laptop and other belongings safe when you need to leave your bag unattended in a public space. The number lock sequence can be changed and customised by your directly.,USB Charging Port: Now charge your devices on the go with your new Fur Jaden backpack without the hassle of carrying a bulk power bank in your pocket/ hand at all times.,Ergonomic Design: This backpack has been designed to ensure equal weight distribution on your shoulders along with padded shoulder straps and breathable air mesh on the back.,Dimension: 42 CM (L) x 30 CM (W) x 18 CM (D). Storage Capacity: 25L. Weight: 600 Grams,Warranty: 1 Year Manufacturer Warranty against Manufacturing Defects"
B08D7DTWLF,"1,476",Cosmus Vogue Casual Laptop Backpack with USB Charger Port 46cm 26 Litre Dark Grey College Bag,4.2,"1,152",,https://amazon.com/dp/B08D7DTWLF,,
B09SWVW69X,961,Cosmus Stallion Laptop Backpack 20 L Polyester Bag for 15.6-inch Laptops,,,,https://amazon.com/dp/B09SWVW69X,Cosmus Stallion Laptop Backpack 20 L Polyester Bag for 15.6-inch Laptops,Cosmus Stallion Laptop Backpack 20 L Polyester Bag for 15.6-inch Laptops
B07B1TFJ7M,799,Fur Jaden Anti Theft Backpack with USB Charging Port 15.6 Inch Laptop Bagpack Waterproof Casual Unisex Bag for School College Office Suitable for Men Women,4.0,"4,827",,https://amazon.com/dp/B07B1TFJ7M,,
B097JN1VZX,"1,999",Safari Seek 45 Ltrs Overnighter Expandable Travel Laptop Backpack,4.5,"3,806",,https://amazon.com/dp/B097JN1VZX,,
B09WDV6HPK,699,"Stylish Laptop Backpack With USB Charging Port, Water Resistant (black)",2.7,5,,https://amazon.com/dp/B09WDV6HPK,,
B084LF4RT5,"1,499","FATMUG Laptop Bag For Men - Convertible Backpack For Office And Travel (Dark Grey ,Oxford Fabric)",4.4,998,,https://amazon.com/dp/B084LF4RT5,,
B07PDYTXD7,349,"The Purple Tree Canvas Tote Bag For Women - 1 Pc , women tote bag , canvas tote bag , printed tote bag , printed canvas tote bag , stylish bags for women TBAG00422",4.3,286,,https://amazon.com/dp/B07PDYTXD7,"Stylish Bags: The Purple Tree presents an affordable range of chic, stylish and classy bags. Perfect Look: Designed for the modern woman, we use a variety of trendy and traditional prints that make you and your bag stand out in the crowd. Colourful: Classic colour combinations as well as mix and match of hip patterns make these bags ideal for any occasion. Occasion: be it work, college,travel, event or a party, there is a perfect bag for everything and everyone. Long Lasting: Comfortable and Spacious, light to hold and long lasting, our line of fashionable sling bags and totes are a must have in any wardrobe Available in beautiful prints, eye catching embroidery and brilliant colours, our bags complement your clothes and accentuate your accessories.Available in beautiful prints, eye catching embroidery and brilliant colours, our bags complement your clothes and accentuate your accessories.","Canvas,Satin,Imported,Printed Canvas tote bag for Women,Outer material: canvas, inner material: Satin,Size- 15x16 inches,Strap type: double handle, closure type: Zipper,1 big compartmnet with 1 inner pocket"
B09T2MRRG3,649,Half Moon 34 L Water Resistant 15.6 inch Laptop Bag/Backpack for Men Women Boys Girls/Office School College with Padded Laptop Compartment (Grey),4.0,850,Half_Moon(Amazing Bags),https://amazon.com/dp/B09T2MRRG3,"FEATURES: DURABLE MATERIAL: Made with strong polyester fabric with heavy zippers. Serves the need of a professional office laptop bag, college bag, student backpack, school bag and is suitable for all, i.e. boys, girls, men and women; COMFY & STURDY: Its padded, adjustable shoulder straps do not put pressure on the shoulders. Foamed padded top handle is easy on your palm and fingers; DURABLE AND LIGHT WEIGHT MATERIAL: Made with strong yet light weight polyester fabric with heavy zippers; INTERNAL ORGANISER: This backpack features an Internal Organiser that is small pockets inside the front compartment for holding pens, ID cards, etc. These pockets are very useful in organizing your small day-to-day items; LOTS OF STORAGE SPACE & POCKETS: One separate Padded laptop compartment. Multiple compartments can store lots of stuff, that too organised.","SPACIOUS AND LIGHTWEIGHT: Light weight and spacious laptop backpack with 3 compartments. One compartment is for carrying laptop inside (Upto 17 inches), with padding for safety, and space for laptop accessories like charger, etc. Second large compartment for books, files and all your day to day essentials. And third compartment is for your extra stuff. It has provision for holding bottles on both sides and has padded shoulder straps for your comfort,COMFORT WITH QUALITY: This casual bag has Wide, Padded and Adjustable shoulder straps and Padded Back for comfort in carrying heavy items. Stitched properly and Bartacks on every pressure point for extra durability. Made with strong yet light weight polyester fabric with heavy zippers. Serves the need of a professional office laptop bag, college bag, student backpack, school bag and is suitable for all, i.e. boys, girls, menं and womenं,PREMIUM FABRIC : Premium Polyester, Stylish and durable backpack for school /college and travel. Easily accommodate a laptop. Size: 45 cm X 31 cm X 22 cm,INTERNAL ORGANISER: This backpack features an Internal Organiser that is small pockets inside the front compartment for holding pens, ID cards, etc. These pockets are very useful in organizing your small day-to-day items.,OTHER FEATURES: Internal Organiser, Strong and durable zippers, Adjustable Shoulder Handles (Straps) , 2 Bottle/Umbrella holders , Padded Handle , Padded Laptop Compartment (can carry laptops of size 13, 14, 15.6 & 17 inches)"
B084VR37RQ,899,"Genie Snowflake 36 Litres Teal & Blue School Backpack (19 inch, Water resistant)",4.4,463,,https://amazon.com/dp/B084VR37RQ,,
B08KR4WRM6,712,Lavie Marma zigzag dome Sling for Women,4.1,"2,123",,https://amazon.com/dp/B08KR4WRM6,,
B084RQPX5K,"2,000",Dattatreya Large Multi Utility Compartments Quilted Work Women Ladies Laptop Hand Bag Purse for College Girls,,,,https://amazon.com/dp/B084RQPX5K,"Water Resistant Cosmus Polyester Navy Blue Laptop backpack is a waterproof backpack which means you can completely submerge the bag in a body of water without letting moisture inside. This backpack made using Water Resistant materials which keeps your belongings to stay dry on a rainy day. Large Compartments This backpack comes with 2 Large compartments, 2 easy access front pockets which helps you to store your phone, tablet, wallet, books, stationery, and many more items. Adjustable Straps Thick and well padded shoulder straps makes the backpack feel lighter while carrying. Adjustable shoulder straps relieve the stress on your shoulders and gives your back comfort and a very good support.","Material : Polyester, Nylon,Color : Grey With Black Finishing,best quality as it is perfectly designed and made from high quality lightweight nylon and double dotted waterproof polyester.,This backpack is made to used for boys, girls, men, women and kids. This bag is very good for boys and girls of age between 11 to 16 years because it has enough space to carry all books and accessories and it is very comfortable and stylish."
B079R8MGX8,"1,258",COSMUS Sedna Dx Polyester 17 LTR Navy Blue Casual Laptop Backpack,4.2,234,,https://amazon.com/dp/B079R8MGX8,"Stylish and Durable for Everyday Use Casual Laptop BagCosmus Sedna DxÂ 15.6 inch laptop backpack is made of High grade water resistance PU coated polyester material that gives it strength and makes it durable for long-term use. It features a zippered well padded Laptop compartment that fits upto 15.6 inch laptop,one large compartment is big enough to hold your office or daily use belongings, it also has two front zippered pockets. Cosmus Sedna backpack features two mesh side pockets, where you can keep your water bottle or any other item for an quick access.Waterproof Laptop Backpack BagMaterial: PolyesterCompartments & Pockets: One main top loaded compartment, One large front Pocket, Two side mesh pocketsCompatible laptop Size: Upto 15.6 inchesÂ","Polyester lining,Zipper closure,PU Coated Water Resistance Polyester Fabric - light in weight and Durable.,1 Large Compartments + 1 large font pockets Organizer section and inner zipper pocket,Well padded Laptop section,Dimensions: 19.5x12.00x4.5 (inches) [HxWxD] ; Volume: 17 Liters,For Customer Product reviews please search 'Cosmus bags' on amazon.in"
