ASIN,Price,Title,Stars,Ratings,Manufacturer,Link,Description,Features
B0756WRR9Z,"1,268",Zipline Office Laptop Vegan Leather Executive Formal 15.6 inch Laptop & MacBook Briefcase Messenger/Office/Travel/Business Bag for Men Women with Multiple compartments (Brown),4.3,787,,https://amazon.com/dp/B0756WRR9Z,,
B08R7RPVJF,729,Lenovo Slim Everyday Backpack,4.4,"1,644",,https://amazon.com/dp/B08R7RPVJF,,
B09154JPWQ,399,ADISA Women's Sling Bag,4.2,"1,611",,https://amazon.com/dp/B09154JPWQ,,
B09VTDMRY7,749,"Fur Jaden Anti Theft Number Lock Backpack Bag with 15.6 Inch Laptop Compartment, USB Charging Port & Organizer Pocket for Men Women Boys Girls",4.1,652,FUR JADEN,https://amazon.com/dp/B09VTDMRY7,"Stay organized all day with a durable and lightweight backpack from Fur Jaden. This back pack is a stylish and functional accessory for men and women. Can add admiration to an appealing and daring personality with a remarkable aesthetics and functionality. This backpack features an anti-theft design. You can also charge your phone on the go and organize your stuff like pro. Fur Jaden functional back pack is apt to protect your gadgets and belongings from being stolen while you travel, thanks to its special anti-theft design. Now keep your belongings safe with style. The backpack features multiple compartments that you may use for your laptop and other essentials. A remarkable feature of this backpack allows you to charge your phone while you are on the move. With an attached charging dock in the back you may connect a portable power bank with ease. Weighing about 600grams, this backpack is lightweight. The backpack is able to house a laptop of up to 15.6 inches and has seven inner compartments to place your other essentials. Made from durable quality polymer this Fur Jaden back pack is sturdy and reliable. Flaunt this bag with style and low maintenance as this bag is washable. This backpack is also suitable for school or college. The straps are designed to distribute the weight equally on each shoulder preventing any sort of discomfort. Use this back pack for office, college/school or during travels.","Number Lock: This Fur Jaden Anti Theft laptop backpack comes equipped with a Number Lock. This helps keep your laptop and other belongings safe when you need to leave your bag unattended in a public space. The number lock sequence can be changed and customised by your directly.,USB Charging Port: Now charge your devices on the go with your new Fur Jaden backpack without the hassle of carrying a bulk power bank in your pocket/ hand at all times.,Ergonomic Design: This backpack has been designed to ensure equal weight distribution on your shoulders along with padded shoulder straps and breathable air mesh on the back.,Dimension: 42 CM (L) x 30 CM (W) x 18 CM (D). Storage Capacity: 25L. Weight: 600 Grams,Warranty: 1 Year Manufacturer Warranty against Manufacturing Defects"
B07NDVJW44,"1,299",The Clownfish Fusion Series 27 litres Laptop Backpack for 15.6 Inch Laptops (Mustard),4.4,235,,https://amazon.com/dp/B07NDVJW44,,"★MATERIAL: This backpack is made of High quality Water resistant Vegan leather material, durable fabric lining, with custom hardware, high-end two way zipper to ensure proper closure with security.,★STORAGE & SPACE: Ideal for laptop upto 15.6"" with 27 liters of Capacity, Dimensions are (L)36 x (W)16 x (H)44 cm.,★FEATURES: External USB port with built-in charging cable offers a convenient charging by connecting with the Portable Charger and your electronic device.Not only that, the backpack has a 3.5mm Stereo plug, which makes it easy for you to enjoy music.(Power bank not included),★CONVENIENT STRUCTION: This bag is designed with 1 main storage compartments, separate cushioned sleeve to carry laptop, Additional 2 outer compartments and side mesh pocket for water bottle or wet umbrella, padded handles and adjustable shoulder strap. Back Panel with high quality mesh breathable for your back."
B09SWV4NB8,851,COSMUS Eternal Laptop Backpack 20 Ltrs Polyester Bags for 15.6-inch Laptops,3.6,3,,https://amazon.com/dp/B09SWV4NB8,COSMUS Eternal Laptop Backpack 20 Ltrs Polyester Bags for 15.6-inch Laptops,COSMUS Eternal Laptop Backpack 20 Ltrs Polyester Bags for 15.6-inch Laptops
B098QFF5TJ,"1,171",Wesley Spartan Unisex Travel Hiking Laptop Bag fits Upto 17.3 inch with Raincover and Internal Organiser Backpack Rucksack College Bag,4.2,477,Wesley,https://amazon.com/dp/B098QFF5TJ,Laptop backpack,Laptop bag fits upto 17.3 inch laptop
B08WQ668WJ,726,ZIPLINE Unisex Casual Polyester 36 L Backpack School Bag Women Men Boys Girls Children Daypack College Bag Book School Sports Bag,3.8,409,Atulitu Agency,https://amazon.com/dp/B08WQ668WJ,"A super-slim design, trendy looks and durable construction - this stylish 36 L backpack from ZIPLINE has got everything that will complement your youthful personality. With its spacious interiors, this unisex backpack is a great option for short road trips, college and work. Ergonomic design Crafted from polyester, this medium backpack is sturdy enough to withstand regular wear and tear gracefully. It features a cushioned base and internal back padding to offer you extra comfort. The padded shoulder straps of this bag can be easily adjusted according to your liking. Spacious Featuring one front pocket and three main compartments, all with speciality zippers, this bag offers you enough space to carry your books, files, coins, travel accessories, stationery, keys and mobile accessories. It comes with the ZIPLINE promise of quality.Product Description","DURABLE MATERIAL: Superior quality durable ECO Friendly waterproof and anti-scratch polyester and featuring a reinforced bottom to withstand heavy use, perfect for business, travel, school, College and other outdoor activities,COMFORTABLE DESIGN: Our backpack's ""S"" Curve adjustable, heavily padded shoulder straps and back panel make the backpack comfortable to wear even when loaded with all your gear,Compact:Backpack has a roomy Three compartment, front zipper pockets to hold small accessories, one internal security zippered pocket for valuable items and side pockets for water bottle or umbrella.,Size:18*13*9 inch(L*W*H), Capacity: 36L which is bigger than others of the same style. Good size for Business, College, camping, travel, shopping, hiking, climbing, Stylish backpack for men and women.,This soft Zipline backpack is classic, nice & modern look and feel, back pack shows your outstanding temperament"
B09X33JVQ7,549,Sketchfab 35 L Casual Waterproof Laptop Bag Grey Laptop/College/School/Office Travel Backpack Unisex Women Men Boys Girls Children Daypack Book Sports Weekend Lightweight Bags for Stylish and Office - Grey,3.6,45,,https://amazon.com/dp/B09X33JVQ7,"Product features 3 main zippered compartments, one well-padded laptop partition, 2 water bottle umbrella pockets and Organizer Pockets inside. Suitable for casual usage, school / college / office n travel .Light weight and spacious laptop backpack with 3 compartments. One compartment is for carrying laptop inside (Upto 17 inches), with padding for safety, and space for laptop accessories like charger, etc. Second large compartment for books, files and all your day to day essentials. And third compartment is for your extra stuff. It has provision for holding bottles on both sides and has padded shoulder straps for your comfort.","Imported Premium Waterproof Canvas, Sturdy, heavy duty construction in thick fabric,Water Repellant: Yes; Laptop Compartment: Yes ; Compartments:3 & 2 Side Pockets for water bottle & other accessories. Deep side pockets can hold a 1 litre bottle of water,COMFORT WITH QUALITY: This casual bag has Wide, Padded and Adjustable shoulder straps and Padded Back for comfort in carrying heavy items. Stitched properly and Bartacks on every pressure point for extra durability. Made with strong yet light weight polyester fabric with heavy zippers. Serves the need of a professional office laptop bag, college bag, student backpack, school bag and is suitable for all, i.e. boys, girls,,PREMIUM FABRIC : Premium Polyester, Stylish and durable backpack for school /college and travel. Easily accommodate a laptop. Size: 20 cm X 12.5 cm X 7.5 cm BACK SUPPORT: We have designed the bag keeping your comfort in mind. Shoulder has high density padding,,Color :- Grey Capacity: 35L ,Weight: 0.4kg"
B09VCLQ9H3,745,"Fast Travel 45 Ltrs, 46 cms School Bag Class 5-12 Large 4 partition Laptop Collage Office Travel Backpack Unisex",4.1,220,Fast Travel,https://amazon.com/dp/B09VCLQ9H3,"A Sporty Versatile School Laptop Collage Office Backpack From Fast Travel, Made Of Polyester. It Has a 3 opening Compartment & 2 For quick & easy access to essential While the mesh padding on the back panel will feel comfortable, even on a hot day. Stylish And Durable Backpack For Office School /College And Travel. Easily Accommodate A Laptop. Size: 46 Cm X 33 Cm X 20 Cm.","Dimension:33 cms x20 cmsx 46 cms (LxWxh),45 liters,Number of Compartments:4 Laptop Compatibility: Up to 16 Inches,Material:Polyester:Water Resistance Level:Waterproof,Warranty Description: Manufacturer; 1 Year Domestic Warranty,Special Features: LightWeight Strong stitching 2 Bottle Pocket Anti-Thift Backpack With Mesh Padding On Back to Provide Better Back Support"
B09Z2RB128,423,Baggit Women Satchel Handbag (MUSHROOM),4.2,5,,https://amazon.com/dp/B09Z2RB128,"Sling bag Beige exterior 1 main compartment Inner zipper Back zipper Long, adjustable handle, Short comfy handle Zipper closure , Gold finished zipper puller Cruelty-free premium material","Sling bag Beige exterior 1 main compartment Inner zipper Back zipper Long, adjustable handle, Short comfy handle Zipper closure , Gold finished zipper puller Cruelty-free premium material"
B09TPVD964,529,ADISA 15.6 inch Laptop Backpack Office Bag College Travel Back Pack 32 Ltrs (z-Teal),4.0,243,ADISA,https://amazon.com/dp/B09TPVD964,"Light weight and spacious laptop backpack with 2 compartments and 1 front easy-access pocket. One compartment is for carrying laptop inside with padding for safety and space for laptop accessories like charger, etc. Other compartment has organiser for pens, visiting cards, etc along with space for carrying papers, files, etc. It has provision for holding bottles on both sides and has padded shoulder straps for your comfort.","Material: Water Resistant Light-Weight Polyester,Compartments: 2 with padding,Laptop Size: 15.6 inch and below,Dimensions: LxWxH - 12.5 x 7.5 x 19 inches,Reflector Logo / Adjustable Padded Shoulder Straps / 2 Bottle holders"
B08SKGRXXJ,499,Northzone Lightweight School Bags Backpacks for Boys Girls Stylish Men and Women Casual Travel Laptop Bag College Office (Green),3.2,19,,https://amazon.com/dp/B08SKGRXXJ,"NORTHZONE BACKPACK If you carry your laptop to and from work, then this laptop bag from Northzone will definitely make travelling easier. Compatibility This backpack can fit a 38.1 cm laptop comfortably. Compartments This bag has three spacious compartments to store the laptop, charger, external devices, and other accessories with ease. Pockets The two mesh pockets on either sides of this black and blue backpack allow you to store a water bottle, ID card and other knick-knacks, so you can access them easily.","COMPATIBLE WITH 15.6 INCH LAPTOP”: The Northzone Backpack fits up to 15.6 inch laptop. Dimensions: 34cm x 15cm x 45.5cm; Weight: 499g,HIGH QUALITY, DURABLE AND WATER REPELLANT FABRIC”: This backpack features in durable snow yarn polyester fabric and streamlined design with a padded interior to protect notebooks and important items,CONVENIENT TRAVEL"" Adjustable shoulder strap and padded laptop compartment together with a quilted back panel make it comfortable for all-day use,CONVENIENTLY PLACED PADDED LAPTOP COMPARTMENTS AND POCKETS: The padded interior helps protect notebooks and important items. Quick access zippered front pocket for added storage. A quilted back panel make it comfortable for all-day use.,HIGH QUALITY, CASUAL YET STYLISH DESIGN"": very attractive and perfect for school, travel and outdoor activities. The perfect backpack for those needing stylish all-day protection for their laptop."
B012D4QKHW,"1,549",Wildcraft 44 cms Polyester Black Laptop Bag (8903338054290),4.4,492,,https://amazon.com/dp/B012D4QKHW,,
B09W2ZX6BS,"1,979","Zouk Unisex Black Lace Laptop Backpacks for Office , College and Travel| Fits upto 15.6 Inch Laptop",,,,https://amazon.com/dp/B09W2ZX6BS,,
B09W33SGW1,"1,979","Zouk Unisex Orange Tidal Wave Laptop Backpacks for Office , College and Travel| Fits upto 15.6 Inch Laptop",5.0,4,,https://amazon.com/dp/B09W33SGW1,,
B09W32H44K,"1,979","Zouk Unisex Green Printed Laptop Backpacks for Office , College and Travel| Fits upto 15.6 Inch Laptop",4.5,2,,https://amazon.com/dp/B09W32H44K,,
B093TCW74C,"3,795","Safari Boombox Backpack with Bluetooth Speakers, Blue",4.3,3,,https://amazon.com/dp/B093TCW74C,,
B07PDYTXD7,349,"The Purple Tree Canvas Tote Bag For Women - 1 Pc , women tote bag , canvas tote bag , printed tote bag , printed canvas tote bag , stylish bags for women TBAG00422",4.3,286,,https://amazon.com/dp/B07PDYTXD7,"Stylish Bags: The Purple Tree presents an affordable range of chic, stylish and classy bags. Perfect Look: Designed for the modern woman, we use a variety of trendy and traditional prints that make you and your bag stand out in the crowd. Colourful: Classic colour combinations as well as mix and match of hip patterns make these bags ideal for any occasion. Occasion: be it work, college,travel, event or a party, there is a perfect bag for everything and everyone. Long Lasting: Comfortable and Spacious, light to hold and long lasting, our line of fashionable sling bags and totes are a must have in any wardrobe Available in beautiful prints, eye catching embroidery and brilliant colours, our bags complement your clothes and accentuate your accessories.Available in beautiful prints, eye catching embroidery and brilliant colours, our bags complement your clothes and accentuate your accessories.","Canvas,Satin,Imported,Printed Canvas tote bag for Women,Outer material: canvas, inner material: Satin,Size- 15x16 inches,Strap type: double handle, closure type: Zipper,1 big compartmnet with 1 inner pocket"
B07NSC4SL5,275,SAFARI 15 Ltrs Denim Blue Casual/School/College Backpack (DAYPACKNEO15CBDNB),4.0,"8,984",,https://amazon.com/dp/B07NSC4SL5,,
B088XH1BP7,249,"Mi Step Out 12 L Mini Backpack (Small Size, Dark Blue, Water Repellant)",4.1,"3,212",,https://amazon.com/dp/B088XH1BP7,,
B08KR4WRM6,712,Lavie Marma zigzag dome Sling for Women,4.1,"2,123",,https://amazon.com/dp/B08KR4WRM6,,
B093DRDJD4,470,Laxella Casual Waterproof Lightweight Laptop Bag/Backpack for Men & Boys /Office School College Teens & Students.(Packof 1),3.4,101,RIDHI CREATION,https://amazon.com/dp/B093DRDJD4,"Light weight and spacious casual backpack with 3 compartments and 1 front easy-access pocket. The back compartment is fully padded for cushioning. The middle compartment has organiser for pens, visiting cards, etc along with space for carrying papers, files, books, etc. It is spacious enough to keep all your stuff. It has provision for holding bottles on both sides and has adjustable padded shoulder straps for your comfort. The logo of the bag is Reflective so it will glow when light hits it which is a very important safety feature, specially when on road. DURABLE AND LIGHT WEIGHT MATERIAL: Made with strong yet light weight polyester fabric with heavy zippers. Serves the need of a professional office backpack, college bag, student backpack, school bag and is suitable for all, i.e. adults, teens, boys, girls. LAXELLA & STURDY: Its padded, adjustable shoulder straps do not put pressure on the shoulders. Foamed padded top handle is easy on your palm and fingers. LOTS OF STORAGE SPACE & POCKETS: 3 full sized compartments and 1 easy access pocket. Multiple compartments and Organiser can store lots of stuff, that too in very efficient and organized way.","COMFORT WITH QUALITY: This casual bag has Wide, Padded and Adjustable shoulder straps and Padded Back for comfort in carrying heavy items. Stitched properly and Bartacks on every pressure point for extra durability. Made with strong yet light weight polyester fabric with heavy zippers. Serves the need of a professional office laptop bag, college bag, student backpack, school bag and is suitable for all, i.e. boys, girls, men and women,SPACIOUS AND LIGHTWEIGHT: Light weight and spacious laptop backpack with 3 compartments. One compartment is for carrying laptop inside, with padding for safety, and space for laptop accessories like charger, etc. Second large compartment for books, files and all your day to day essentials. And third compartment is for your extra stuff. It has provision for holding bottles on both sides and has padded shoulder straps for your comfort.,Laptop compatibility: yes, laptop size: 16strap type: adjustable,Warranty type: Manufacturer; one year warranty against all manufacturing defects, workmanship,Anti theft waterproof bag with anti sweat fabric on back and shoulder straps"
B07PS38XSP,249,Fur Jaden Hiking Camping Rucksack Casual 10 Ltrs Blue Casual Backpack,3.6,"6,389",,https://amazon.com/dp/B07PS38XSP,,
B08TT7PXHJ,549,Parvenir Office Laptop Bags Briefcase 39.62cm (15.6 Inch) for Women and Men (Pink) (Parv-108P),5.0,1,,https://amazon.com/dp/B08TT7PXHJ,,"✔Multipurpose storage capacity- these bags comes with more storage zipper compartment to fulfill all your personal items storage as cables, laptops, powerbanks, cell phones, chargers, book/diary etc.,✔Function and Design- Removable and adjustable padding shoulder strap and dual sturdy handles for long time comfortably carrying. Hideable handle strap, when hided easier to slide to your bagpacks.,✔Water Resistance- these shoulder bags comes with resistance polyester nylon lamination fabrics,✔Protection- with this bag be free from worry of water splash or spills(do not use in heavy rain) 360 degree protective shockproof soft lining effective to absorb impact and reduce damages caused by accidental scratches and bumping,✔Professional& Sleek - This bag is one step solution for daily commutation, a tote for college goers, or a shoulder bag for an easy travel for work. Luggage straps allows laptop bag to be fix on Luggage or suitcase. suitable for most popular tablets/Laptop/Notebook/I Pads"
B094GB8VS2,649,"World Speed 15.6-inch Laptop Computer Briefcase,Water Resistant, Business Bag with Waterproof Zipper,Shoulder Bag Artificial Leather Handbag,Compatible with laptop MacBook Notebook,for Men/Women",4.2,390,WORLD SPEED,https://amazon.com/dp/B094GB8VS2,"SPACIOUS STORAGE & COMFORTABLE FOR TRAVEL - Fit all your stuff easily! Pockets include the main pocket for books, food, umbrellas, etc. - You have a thick padded pouch for protecting your laptop, special pockets for phones, ID cards, and a unique cool hooking system for all your wires! The sleek design allows easy and comfortable travel while not compromising on space. don't buy those bulky bags that are heavy and have limited space, they will just drag you with them all day. Buy WORLD SPEED","WATER RESISTANCE - The shoulder bag is made of high-quality water resistant polyester fabric with PU coating and equipped with waterproof zipper. It will protect your Notebook PC from dust, scrapes and scratches & spills.,MULTI-COMPARTMENT ORGANIZER - Main compartment includes a 15.6"" padded laptop compartment & a tablet pocket. One zippered front compartment with organizational pockets for pens, keys, cell phone, cables, mouse & other small items.,EASILY CARRYING - Removable & adjustable padding shoulder strap varied from 30 to 52 inches & dual sturdy handles for long time comfortably carrying. A smart choice for school, college, business, travelling & etc.,Multi-Compartment Organizer: The men laptop briefcase includes external 2 pouches & 2 pen slots and inside several slots in front large pocket with Velcro closure under flap over, storage pen holders, documents, binder, power cords, mouse; 1 main zipper Pocket with foam padded sleeve fits most 15 15. 6 inch Laptop notebooks MacBook Ultrabook Chromebook; back invisible zipper pocket for your valuables,Durable Material: This computer laptop bag is made of high quality water resistant durable synthetic nylon fabric polyester with smooth metal zipper and durable metal hook of strap;Stylish and functional,this is a nice gift idea for Mothers day ,Fathers day from daughter son"
B075DZW79N,"22,610","Architecture Urban, Corbusier Backpack",4.2,12,VICTORINOX,https://amazon.com/dp/B075DZW79N,"Architecture urban, Corbusier, grey/brown","Unmatched design and quality. Experience and Swiss tradition.,Capacity: 26.0,Package Weight: 2.16 kilograms,Package Dimensions: 26.8 L x 47.4 H x 34.2 W (centimetres)"
B09SWWXDSD,851,COSMUS Eternal Laptop Backpack 20 Ltrs Polyester Bags for 15.6-inch Laptops,3.6,3,,https://amazon.com/dp/B09SWWXDSD,COSMUS Eternal Laptop Backpack 20 Ltrs Polyester Bags for 15.6-inch Laptops,COSMUS Eternal Laptop Backpack 20 Ltrs Polyester Bags for 15.6-inch Laptops
B09Z2RB128,423,Baggit Women Satchel Handbag (MUSHROOM),4.2,5,,https://amazon.com/dp/B09Z2RB128,"Sling bag Beige exterior 1 main compartment Inner zipper Back zipper Long, adjustable handle, Short comfy handle Zipper closure , Gold finished zipper puller Cruelty-free premium material","Sling bag Beige exterior 1 main compartment Inner zipper Back zipper Long, adjustable handle, Short comfy handle Zipper closure , Gold finished zipper puller Cruelty-free premium material"
B07RC94TG8,822,"POLESTAR Xplore 55 L Hiking/ Trekking/ Camping/ Travelling Rucksack Backpack with rain cover, shoe compartment, water resistant, made with polyester, 1 year warranty",4.1,"10,086",POLE STAR,https://amazon.com/dp/B07RC94TG8,"These rucksacks are lightweight, have a soft and ventilated back panel, and are perfect for carrying all your necessities. Adjustable and breathable padded shoulder strap to meet different requirements for both men and women; made from highly rip and water resistant polyester fabric, provide strengthen and long-lasting performance ; roomy enough for your traveling requirements also having a Rain cover.","** RAIN COVER & WATER PROOF BASE : a rain cover can make hiking in bad weather as enjoyable as hiking in good weather. Thats why we are providing a Free Rain Cover (placed INSIDE the bottom Pocket ) that enhanced the durability by using a Heavy Duty water proof and durable fabric for the base that is good enough for long lasting protection.,** SPACIOUS & ORGANIZED >> Product Dimensions (L x W x H = 62 cm x 36 cm x 24 cm ) Polestar Rucksack lightweight comes with one zippered main compartment having the capacity of approx 55 Ltr, + front long Zippered pocket + Top zipper pocket for easy access things and two side net pockets + a Complementary RAIN COVER in Bottom zip pocket,** SHOE COMPARTMENT: An outside completely separate spacious œSHOE Compartment is provided so that you can access the pair of shoes comfortably without upsetting the other things.,** BREATHABLE MESH SPONGE PADDING : the back panel is sufficiently padded with breathable mesh to make your journey comfortable all day long and provides proper air circulation . Ergonomic S-curved straps help spread the weight around and give arms extra flexibility and movability.,**YOGA MAT HOLDERS: the rucksack has two adjustable straps at the back to place a Yoga Mat or foldable tents that are difficult to adjust inside the backpack and making it Most Suitable for hiking, trekking, overnight trip, camping or biking and for both men and women."
B091SNKKB4,999,70L Travel Backpack Hiking Bag Adventure Camping Trekking Bag Rucksack -70L,4.0,967,AFN FASHION,https://amazon.com/dp/B091SNKKB4,"AFN FASHION is a reliable, convenient and complete multi-pocket pack: a companion for all your short and long range adventures. its super-roomy compartments and many pockets let you organize your gear simply and efficiently. get ready for an adventurous trip by packing your stuff in this 70L Rucksack, unisex backpack from AFN FASHION. this spacious backpack will accommodate all your essentials with ease and so is a must-have. made from polyester, this durable backpack will be a true travel companion.","Multiple pockets with zippered closures hold your belongings securely. Keep your storage organized. Adjustable straps for extra security and flexibility,Adjustable Waist Belt, Extended Shoulder Strap,Bottle Pouch on both sides,Drawstring & Zip Closure,Dimension (HxLxW) -(71x36x22 cm)(28x14x8.5 inch)"
